{
    "title": "My First UiUi Panel",
    "comment": "--",
    "outfile": "./first.uiui.rendered",
    "render": "-- this is a render output of uiui\n----------------------------------",
    "children": [
        {
            "direction": "column",
            "children": [
                {
                    "id": "value1",
                    "title": "Value 1",
                    "ctrl": "slider",
                    "render": "v1 = #value1",
                    "minValue": 0,
                    "maxValue": 5,
                    "step": 1,
                    "defaultValue": 4,
                    "postProcess": "value/2"
                },
                {
                    "title": "Parameter Group",
                    "render": "v2 = #value2\nv3 = #value3",
                    "children": [
                        {
                            "id": "value2",
                            "title": "Value 1",
                            "ctrl": "slider"
                        },
                        {
                            "id": "value3",
                            "title": "Value 2",
                            "ctrl": "slider"
                        }
                    ]
                }
            ]
        }
    ]
}